{"schema_version":"opening-result.v1","prediction_id":null,"market_date":null,"status":"not_applicable","target_time":"09:00:00+08:00","verified_at":null,"attempts":0,"attempt_log":[],"actual_open":null,"actual_change_points":null,"actual_direction":"unknown","direction_correct":null,"signed_error_points":null,"absolute_error_points":null,"source":{"name":"TWSE MIS TAIEX","url":"https://mis.twse.com.tw/stock/api/getStockInfo.jsp?ex_ch=tse_t00.tw&json=1&delay=0","observed_at":null,"fetched_at":null,"official":true},"error":"今日尚未完成實際開盤驗證"}